{
  "id": "builder_result.b6ad46f20297de68944d65e4",
  "entity_type": "ticket_builder_result",
  "status": "FAILURE",
  "primary_attempt_id": "builder_attempt.c01afc1b026e4cd919d51229",
  "selected_attempt_id": null,
  "attempts": [
    {
      "attempt_id": "builder_attempt.c01afc1b026e4cd919d51229",
      "attempt_kind": "PRIMARY",
      "parent_attempt_id": null,
      "configuration": {
        "id": "builder_config.storage_unsatisfiable",
        "entity_type": "ticket_builder_configuration",
        "configuration_version": "ticket-builder-v1",
        "scenario_or_mode_context": "SIMULATION",
        "requested_ticket_count": 1,
        "seed": "task-009-builder-unsat-seed",
        "generator_version": "ticket-builder-v1",
        "content_version": "core-ticket-templates-v1",
        "domain_content_version": "core-domain-snapshot-v1",
        "card_catalog_version": "core-card-catalog-v1",
        "allowed_domain_ids": [],
        "excluded_domain_ids": [],
        "allowed_tags": [
          "storage"
        ],
        "excluded_tags": [
          "storage"
        ],
        "guaranteed_categories": [],
        "required_teaching_beats": [],
        "authored_difficulty_bounds": {
          "minimum": 1,
          "maximum": 4
        },
        "fault_count_bounds": {
          "minimum": 1,
          "maximum": 2
        },
        "required_actionable_fault_count_bounds": {
          "minimum": 1,
          "maximum": 2
        },
        "causal_depth_bounds": {
          "minimum": 0,
          "maximum": 1
        },
        "inbound_branching_bounds": {
          "minimum": 0,
          "maximum": 1
        },
        "outbound_branching_bounds": {
          "minimum": 0,
          "maximum": 1
        },
        "progressive_difficulty_profile": {
          "profile_id": "profile.storage_unsatisfiable",
          "profile_version": "v1",
          "explicit_ceiling": 4,
          "bands": [
            {
              "start_generated_index": 0,
              "end_generated_index": 0,
              "target": 2,
              "minimum": 1,
              "maximum": 4
            }
          ]
        },
        "generation_index_start": 0,
        "allow_duplicate_causal_fingerprints": false,
        "active_causal_fingerprints": [],
        "legal_card_definition_ids": [
          "card.core.visual_inspection",
          "card.core.raid_status_inspection",
          "card.core.drive_health_test",
          "card.core.storage_device_inventory",
          "card.core.smartctl_drive_health",
          "card.core.replace_raid_member",
          "card.core.rebuild_raid_array",
          "card.core.reseat_storage_cable",
          "card.core.raid_health_verification",
          "card.core.storage_detection_verification"
        ],
        "fallback_configuration_id": null
      },
      "status": "FAILURE",
      "diagnostics": [
        {
          "code": "NO_ELIGIBLE_TEMPLATE",
          "constraint": "ALLOWED_EXCLUDED",
          "detail": "No authored template satisfies the allowed/excluded domain and tag filters.",
          "template_ids": [
            "ticket_template.storage.loose_cable",
            "ticket_template.storage.member_then_array",
            "ticket_template.storage.single_sas_member"
          ],
          "requested_count": 1,
          "eligible_count": 0,
          "generated_index": null
        },
        {
          "code": "REQUESTED_COUNT_UNSATISFIABLE",
          "constraint": "REQUESTED_COUNT",
          "detail": "No complete candidate batch satisfies every hard constraint.",
          "template_ids": [],
          "requested_count": 1,
          "eligible_count": 0,
          "generated_index": null
        }
      ],
      "selected_template_ids": [],
      "ticket_snapshot_digests": [],
      "ticket_snapshots": []
    }
  ]
}
